<!DOCTYPE html>
<html lang="en">
<head>
    <meta charset="UTF-8">
    <meta name="viewport" content="width=device-width, initial-scale=1.0">
    <title>SSLC Exam Insights 2026</title>
    <script src="https://cdn.tailwindcss.com"></script>
    <link href="https://fonts.googleapis.com/css2?family=Inter:wght@400;500;600;700;800;900&display=swap" rel="stylesheet">
    <style>
        body { font-family: 'Inter', sans-serif; }
        .no-scrollbar::-webkit-scrollbar { display: none; }
        .no-scrollbar { -ms-overflow-style: none; scrollbar-width: none; }
        
        /* Floating Watermark Refined */
        #watermark {
            position: fixed;
            top: 1rem;
            left: 1.5rem;
            z-index: 99999;
            font-size: 9px;
            font-weight: 800;
            color: #ffffff;
            text-transform: uppercase;
            letter-spacing: 0.15em;
            pointer-events: none;
            user-select: none;
            background: rgba(0, 0, 0, 0.4);
            border: 1px solid rgba(255, 255, 255, 0.1);
            padding: 4px 12px;
            border-radius: 20px;
            backdrop-filter: blur(8px);
            box-shadow: 0 4px 12px rgba(0, 0, 0, 0.1);
            display: flex;
            align-items: center;
            gap: 6px;
        }

        .tab-content { display: none; }
        .tab-content.active { display: block; }
        
        /* Smooth transitions */
        .transition-all { transition: all 0.3s cubic-bezier(0.4, 0, 0.2, 1); }
    </style>
</head>
<body class="bg-[#fafbfc] text-slate-900">

    <div id="watermark">
        <span style="opacity: 0.6;">🛠️</span>
        DEVELOPED BY PRANAVKUMAR MATH &middot; ChaturAi Tecnologies
    </div>

    <!-- PIN LOCK SCREEN -->
    <div id="lock-screen" class="fixed inset-0 bg-slate-900 z-[10000] flex items-center justify-center p-6">
        <div class="bg-white p-8 rounded-3xl shadow-2xl max-w-sm w-full text-center">
            <div class="w-16 h-16 bg-indigo-100 rounded-2xl flex items-center justify-center text-indigo-600 mx-auto mb-6">
                <svg xmlns="http://www.w3.org/2000/svg" width="32" height="32" viewBox="0 0 24 24" fill="none" stroke="currentColor" stroke-width="2" stroke-linecap="round" stroke-linejoin="round"><rect width="18" height="11" x="3" y="11" rx="2" ry="2"/><path d="M7 11V7a5 5 0 0 1 10 0v4"/></svg>
            </div>
            <h1 class="text-2xl font-black text-slate-900 mb-2 tracking-tight">Access Locked</h1>
            <p class="text-slate-500 text-sm mb-6 font-medium uppercase tracking-widest">Enter Pin to View Insights</p>
            <div class="space-y-4">
                <input type="password" id="pin-input" maxlength="4" placeholder="••••" 
                    class="w-full text-center text-3xl font-black tracking-[1em] py-4 border-2 border-slate-100 rounded-2xl focus:border-indigo-600 focus:outline-none transition-all">
                <button onclick="checkPin()" class="w-full bg-slate-900 text-white font-black py-4 rounded-2xl flex items-center justify-center gap-2 hover:bg-indigo-700 transition-all active:scale-95">
                    Unlock Dashboard
                </button>
            </div>
        </div>
    </div>

    <!-- MAIN DASHBOARD -->
    <div id="dashboard" class="hidden min-h-screen pb-12">
        <!-- Header -->
        <header class="bg-slate-900 text-white pt-16 pb-24 px-6 text-center relative overflow-hidden">
            <div class="max-w-4xl mx-auto relative z-10">
                <div class="inline-flex items-center gap-2 bg-white/5 border border-white/10 px-3 py-1 rounded-full text-indigo-300 text-[10px] font-black uppercase mb-4 backdrop-blur-sm">
                    <svg xmlns="http://www.w3.org/2000/svg" width="12" height="12" viewBox="0 0 24 24" fill="none" stroke="currentColor" stroke-width="2" stroke-linecap="round" stroke-linejoin="round"><path d="m12 3-1.912 5.813a2 2 0 0 1-1.275 1.275L3 12l5.813 1.912a2 2 0 0 1 1.275 1.275L12 21l1.912-5.813a2 2 0 0 1 1.275-1.275L21 12l-5.813-1.912a2 2 0 0 1-1.275-1.275L12 3Z"/></svg>
                    SSLC Achievement Portal
                </div>
                <h1 class="text-3xl md:text-5xl font-black tracking-tighter mb-4 uppercase">EXAM INSIGHTS 2026</h1>
                <p id="quote-text" class="text-slate-400 italic text-sm md:text-lg font-medium max-w-xl mx-auto min-h-[3rem]">
                    "Success is the sum of small efforts repeated daily."
                </p>
            </div>
        </header>

        <main class="max-w-6xl mx-auto px-6 -mt-16 relative z-20">
            <!-- Phase Countdowns -->
            <div class="grid grid-cols-2 lg:grid-cols-4 gap-4 mb-8" id="phase-timers">
                <!-- Timers injected by JS -->
            </div>

            <!-- Controls -->
            <div class="flex flex-col md:flex-row gap-4 mb-8">
                <div class="flex-1 bg-white p-1.5 rounded-2xl shadow-sm border border-slate-200 flex overflow-x-auto no-scrollbar scroll-smooth">
                    <button onclick="setActiveTab('final')" id="tab-final" class="tab-btn flex-1 min-w-[120px] py-2.5 px-4 rounded-xl font-bold text-xs transition-all duration-200">Final Exam</button>
                    <button onclick="setActiveTab('prep1')" id="tab-prep1" class="tab-btn flex-1 min-w-[120px] py-2.5 px-4 rounded-xl font-bold text-xs transition-all duration-200">Prep 1</button>
                    <button onclick="setActiveTab('prep2')" id="tab-prep2" class="tab-btn flex-1 min-w-[120px] py-2.5 px-4 rounded-xl font-bold text-xs transition-all duration-200">Prep 2</button>
                    <button onclick="setActiveTab('prep3')" id="tab-prep3" class="tab-btn flex-1 min-w-[120px] py-2.5 px-4 rounded-xl font-bold text-xs transition-all duration-200">Prep 3</button>
                    <button onclick="setActiveTab('materials')" id="tab-materials" class="tab-btn flex-1 min-w-[120px] py-2.5 px-4 rounded-xl font-bold text-xs transition-all duration-200">Materials</button>
                </div>

                <div class="relative w-full md:w-80">
                    <svg class="absolute left-4 top-1/2 -translate-y-1/2 text-slate-400" xmlns="http://www.w3.org/2000/svg" width="18" height="18" viewBox="0 0 24 24" fill="none" stroke="currentColor" stroke-width="2" stroke-linecap="round" stroke-linejoin="round"><circle cx="11" cy="11" r="8"/><path d="m21 21-4.3-4.3"/></svg>
                    <input type="text" id="search-input" oninput="handleSearch()" placeholder="Quick subject search..." 
                        class="w-full pl-12 pr-4 py-3 bg-white border border-slate-200 rounded-2xl text-sm font-medium focus:outline-none focus:ring-4 focus:ring-indigo-500/10 focus:border-indigo-500 transition-all shadow-sm">
                </div>
            </div>

            <!-- Table Views -->
            <div id="exam-tables" class="space-y-6">
                <!-- Tables injected by JS -->
            </div>

            <!-- Goal Card -->
            <div class="mt-12 bg-slate-900 rounded-[3rem] p-10 text-white relative overflow-hidden shadow-2xl border border-white/5">
                <div class="absolute top-0 right-0 w-64 h-64 bg-indigo-500/10 rounded-full blur-3xl -mt-32 -mr-32"></div>
                <div class="relative z-10 flex flex-col md:flex-row items-center justify-between gap-8">
                    <div class="text-center md:text-left">
                        <h2 class="text-3xl font-black mb-3 flex items-center justify-center md:justify-start gap-3 tracking-tighter">
                            <svg class="text-indigo-400" xmlns="http://www.w3.org/2000/svg" width="32" height="32" viewBox="0 0 24 24" fill="none" stroke="currentColor" stroke-width="2" stroke-linecap="round" stroke-linejoin="round"><circle cx="12" cy="12" r="10"/><circle cx="12" cy="12" r="6"/><circle cx="12" cy="12" r="2"/></svg>
                            SSLC SUCCESS GOAL 2026
                        </h2>
                        <p class="text-slate-400 text-base max-w-lg font-medium leading-relaxed">
                            Stay disciplined. Use the preparatory rounds as mirrors for your final performance. Official Student Corner docs are your map to victory!
                        </p>
                    </div>
                    <div class="flex gap-4">
                       <div class="bg-white/5 border border-white/10 p-5 px-8 rounded-3xl text-center backdrop-blur-md">
                          <p class="text-[10px] font-black uppercase text-indigo-400 mb-1">Mantra</p>
                          <p class="text-xl font-black tracking-tighter italic">Consistency</p>
                       </div>
                       <div class="bg-indigo-600 p-5 px-8 rounded-3xl text-center shadow-xl shadow-indigo-600/30">
                          <p class="text-[10px] font-black uppercase text-white/70 mb-1">Target</p>
                          <p class="text-xl font-black tracking-tighter underline underline-offset-4 decoration-2">Distinction</p>
                       </div>
                    </div>
                </div>
            </div>
        </main>

        <footer class="text-center mt-16 opacity-30 pb-16">
            <p class="text-[10px] font-black uppercase tracking-[0.5em]">Academic Intelligence Framework &middot; 2026</p>
        </footer>
    </div>

    <script>
        const PIN = "2026";
        const EXAM_DATA = {
            final: {
                title: 'Final SSLC Exam 2026',
                startDate: '2026-03-18T10:00:00',
                color: 'bg-rose-600',
                schedule: [
                    { date: '18-03-2026', iso: '2026-03-18T10:00:00', subject: 'English (1st Language)', time: '10:00 AM' },
                    { date: '23-03-2026', iso: '2026-03-23T10:00:00', subject: 'Science', time: '10:00 AM' },
                    { date: '25-03-2026', iso: '2026-03-25T10:00:00', subject: 'Kannada (2nd Language)', time: '10:00 AM' },
                    { date: '28-03-2026', iso: '2026-03-28T10:00:00', subject: 'Mathematics', time: '10:00 AM' },
                    { date: '30-03-2026', iso: '2026-03-30T10:00:00', subject: 'Hindi (3rd Language)', time: '10:00 AM' },
                    { date: '02-04-2026', iso: '2026-04-02T10:00:00', subject: 'Social Science (SST)', time: '10:00 AM' },
                ]
            },
            prep1: {
                title: 'Preparatory-1',
                startDate: '2026-01-05T10:00:00',
                color: 'bg-indigo-600',
                schedule: [
                    { date: '05-01-2026', iso: '2026-01-05T10:00:00', subject: 'English (1st Language)', time: '10:00 AM' },
                    { date: '06-01-2026', iso: '2026-01-06T10:00:00', subject: 'Mathematics', time: '10:00 AM' },
                    { date: '07-01-2026', iso: '2026-01-07T10:00:00', subject: 'Kannada (2nd Language)', time: '10:00 AM' },
                    { date: '08-01-2026', iso: '2026-01-08T10:00:00', subject: 'Hindi (3rd Language)', time: '10:00 AM' },
                    { date: '09-01-2026', iso: '2026-01-09T10:00:00', subject: 'Science', time: '10:00 AM' },
                    { date: '10-01-2026', iso: '2026-01-10T10:00:00', subject: 'Social Science (SST)', time: '10:00 AM' },
                ]
            },
            prep2: {
                title: 'Preparatory-2',
                startDate: '2026-01-27T10:00:00',
                color: 'bg-emerald-600',
                schedule: [
                    { date: '27-01-2026', iso: '2026-01-27T10:00:00', subject: 'English (1st Language)', time: '10:00 AM' },
                    { date: '28-01-2026', iso: '2026-01-28T10:00:00', subject: 'Mathematics', time: '10:00 AM' },
                    { date: '29-01-2026', iso: '2026-01-29T10:00:00', subject: 'Kannada (2nd Language)', time: '10:00 AM' },
                    { date: '30-01-2026', iso: '2026-01-30T10:00:00', subject: 'Hindi (3rd Language)', time: '10:00 AM' },
                    { date: '31-01-2026', iso: '2026-01-31T10:00:00', subject: 'Science', time: '10:00 AM' },
                    { date: '02-02-2026', iso: '2026-02-02T10:00:00', subject: 'Social Science (SST)', time: '10:00 AM' },
                ]
            },
            prep3: {
                title: 'Preparatory-3',
                startDate: '2026-02-23T10:00:00',
                color: 'bg-amber-600',
                schedule: [
                    { date: '23-02-2026', iso: '2026-02-23T10:00:00', subject: 'English (1st Language)', time: '10:00 AM' },
                    { date: '24-02-2026', iso: '2026-02-24T10:00:00', subject: 'Mathematics', time: '10:00 AM' },
                    { date: '25-02-2026', iso: '2026-02-25T10:00:00', subject: 'Kannada (2nd Language)', time: '10:00 AM' },
                    { date: '26-02-2026', iso: '2026-02-26T10:00:00', subject: 'Hindi (3rd Language)', time: '10:00 AM' },
                    { date: '27-02-2026', iso: '2026-02-27T10:00:00', subject: 'Science', time: '10:00 AM' },
                    { date: '28-02-2026', iso: '2026-02-28T10:00:00', subject: 'Social Science (SST)', time: '10:00 AM' },
                ]
            }
        };

        const QUOTES = [
            "Success is the sum of small efforts repeated daily.",
            "Your only limit is your mind. Keep pushing!",
            "The future belongs to those who prepare for it today.",
            "Stay focused, stay humble, work hard.",
            "One day at a time. You've got this!"
        ];

        let activeTab = 'final';

        function checkPin() {
            const input = document.getElementById('pin-input');
            if (input.value === PIN) {
                document.getElementById('lock-screen').classList.add('hidden');
                document.getElementById('dashboard').classList.remove('hidden');
                initDashboard();
            } else {
                input.value = '';
                input.classList.add('border-red-500');
                setTimeout(() => input.classList.remove('border-red-500'), 500);
            }
        }

        function initDashboard() {
            renderTimers();
            renderTables();
            setActiveTab('final');
            startGlobalIntervals();
        }

        function renderTimers() {
            const container = document.getElementById('phase-timers');
            container.innerHTML = Object.keys(EXAM_DATA).map(key => {
                const phase = EXAM_DATA[key];
                return `
                    <div class="p-4 rounded-xl text-white shadow-sm flex flex-col justify-center ${phase.color}">
                        <span class="text-[10px] uppercase font-black tracking-widest opacity-80 mb-1">${phase.title}</span>
                        <div class="flex gap-2 items-baseline">
                            <span id="timer-phase-${key}" class="text-2xl font-black">0</span>
                            <span class="text-[10px] uppercase opacity-70">Days left</span>
                        </div>
                    </div>
                `;
            }).join('');
        }

        function renderTables() {
            const container = document.getElementById('exam-tables');
            let html = '';
            
            Object.keys(EXAM_DATA).forEach(key => {
                const phase = EXAM_DATA[key];
                html += `
                    <div id="content-${key}" class="tab-content bg-white rounded-3xl shadow-sm border border-slate-200 overflow-hidden">
                        <div class="overflow-x-auto">
                            <table class="w-full text-left border-collapse">
                                <thead class="bg-slate-50 border-b border-slate-200 text-slate-500 text-[10px] uppercase font-black tracking-widest">
                                    <tr>
                                        <th class="px-8 py-5">Exam Date</th>
                                        <th class="px-8 py-5">Subject</th>
                                        <th class="px-8 py-5">Time</th>
                                        <th class="px-8 py-5 text-right">Countdown</th>
                                    </tr>
                                </thead>
                                <tbody class="divide-y divide-slate-100">
                                    ${phase.schedule.map((exam, i) => `
                                        <tr class="exam-row hover:bg-indigo-50/30 transition-all duration-200 group" data-subject="${exam.subject.toLowerCase()}" data-date="${exam.date}">
                                            <td class="px-8 py-6">
                                                <span class="text-sm font-bold text-slate-800 tracking-tight group-hover:text-indigo-900">${exam.date}</span>
                                            </td>
                                            <td class="px-8 py-6">
                                                <span class="text-base font-black text-slate-900 tracking-tighter block leading-tight">${exam.subject}</span>
                                            </td>
                                            <td class="px-8 py-6">
                                                <span class="text-xs font-medium text-slate-500 tracking-tight bg-slate-100 px-2 py-1 rounded-lg">${exam.time}</span>
                                            </td>
                                            <td class="px-8 py-6 flex justify-end">
                                                <div id="timer-row-${key}-${i}" class="flex items-center gap-1.5 text-xs font-bold text-indigo-700 bg-indigo-50 px-2 py-1 rounded-md border border-indigo-100">
                                                    Loading...
                                                </div>
                                            </td>
                                        </tr>
                                    `).join('')}
                                </tbody>
                            </table>
                        </div>
                    </div>
                `;
            });

            // Add Materials Tab
            html += `
                <div id="content-materials" class="tab-content space-y-6">
                    <div class="bg-indigo-50 border border-indigo-100 rounded-3xl p-6 flex gap-5 items-start shadow-sm">
                        <div class="bg-indigo-600 p-3 rounded-2xl text-white shadow-lg shadow-indigo-200">
                            <svg width="24" height="24" viewBox="0 0 24 24" fill="none" stroke="currentColor" stroke-width="2" stroke-linecap="round" stroke-linejoin="round"><circle cx="12" cy="12" r="10"/><line x1="12" y1="16" x2="12" y2="12"/><line x1="12" y1="8" x2="12.01" y2="8"/></svg>
                        </div>
                        <div class="text-sm">
                            <h4 class="font-black text-indigo-900 uppercase tracking-tight text-xs mb-2">Official Student Corner Guide</h4>
                            <p class="text-indigo-800 leading-relaxed font-medium">
                                Visit <span class="font-black underline italic">kseab.karnataka.gov.in</span> on your phone. Click the <span class="font-black">three horizontal lines</span> (top-right). Select <span class="font-black bg-indigo-200/50 px-1 rounded">SSLC</span>, then choose <span class="font-black text-indigo-900 italic">SSLC STUDENT CORNER</span>.
                            </p>
                        </div>
                    </div>
                    <div class="grid grid-cols-1 md:grid-cols-2 lg:grid-cols-3 gap-6">
                        ${MATERIAL_LINKS.map(link => `
                            <a href="${link.url}" target="_blank" class="group p-8 rounded-[2.5rem] border transition-all duration-300 flex flex-col justify-between ${link.highlight ? 'bg-indigo-900 text-white' : 'bg-white border-slate-200 shadow-sm hover:border-indigo-400'}">
                                <div>
                                    <h3 class="font-black text-xl mb-2">${link.name}</h3>
                                    <span class="text-[10px] font-black uppercase tracking-widest opacity-60">${link.type}</span>
                                </div>
                                <div class="mt-6 flex items-center justify-between font-black text-xs uppercase">
                                    <span>Access</span>
                                    <svg width="16" height="16" viewBox="0 0 24 24" fill="none" stroke="currentColor" stroke-width="2"><path d="M18 13v6a2 2 0 0 1-2 2H5a2 2 0 0 1-2-2V8a2 2 0 0 1 2-2h6"/><polyline points="15 3 21 3 21 9"/><line x1="10" y1="14" x2="21" y2="3"/></svg>
                                </div>
                            </a>
                        `).join('')}
                    </div>
                </div>
            `;
            
            container.innerHTML = html;
        }

        const MATERIAL_LINKS = [
            { name: 'KSEAB Official Portal', url: 'https://kseeb.karnataka.gov.in/KOSMIG/', type: 'Official Department', highlight: true },
            { name: 'Full Materials Folder', url: 'https://drive.google.com/drive/folders/1ayOsI6C0eVI-wfU7_c0gF8jylZan9xCj?usp=sharing', type: 'All-in-One' },
            { name: 'English (1st Lang)', url: 'https://drive.google.com/drive/folders/1TDTlnfrJHKmfzUDvsGjiDWHtx7BOcN5T?usp=drive_link', type: 'Language' },
            { name: 'Kannada (2nd Lang)', url: 'https://drive.google.com/drive/folders/14HsO5I3_OPr5c-vimm4a51mXypdF05rn?usp=drive_link', type: 'Language' },
            { name: 'Hindi (3rd Lang)', url: 'https://drive.google.com/drive/folders/1v-DALIdFn0ik3l6fVssx6md2EmQWxh4P?usp=drive_link', type: 'Language' },
            { name: 'Mathematics', url: 'https://drive.google.com/drive/folders/1sFMflnaw2TU3_Z9jvgNc84Zry_3nyGp8?usp=drive_link', type: 'Core' },
            { name: 'Science', url: 'https://drive.google.com/drive/folders/1upSwyzKHsw3WoDCQfu35eEHT8TjasulL?usp=drive_link', type: 'Core' },
            { name: 'Social Science', url: 'https://drive.google.com/drive/folders/1yCf3sH-ukXs86IPCbnfJbA9padCnAjN4?usp=drive_link', type: 'Core' },
        ];

        function setActiveTab(id) {
            activeTab = id;
            document.querySelectorAll('.tab-content').forEach(el => el.classList.remove('active'));
            document.getElementById('content-' + id).classList.add('active');
            
            document.querySelectorAll('.tab-btn').forEach(btn => btn.classList.remove('bg-slate-900', 'text-white', 'shadow-lg'));
            document.getElementById('tab-' + id).classList.add('bg-slate-900', 'text-white', 'shadow-lg');
            
            document.getElementById('search-input').value = '';
            handleSearch();
        }

        function handleSearch() {
            const query = document.getElementById('search-input').value.toLowerCase();
            const rows = document.querySelectorAll('.exam-row');
            rows.forEach(row => {
                const subject = row.getAttribute('data-subject');
                const date = row.getAttribute('data-date');
                if (subject.includes(query) || date.includes(query)) {
                    row.classList.remove('hidden');
                } else {
                    row.classList.add('hidden');
                }
            });
        }

        function startGlobalIntervals() {
            setInterval(updateAllTimers, 1000);
            updateAllTimers();

            let quoteIdx = 0;
            setInterval(() => {
                quoteIdx = (quoteIdx + 1) % QUOTES.length;
                document.getElementById('quote-text').innerText = `"${QUOTES[quoteIdx]}"`;
            }, 8000);
        }

        function updateAllTimers() {
            const now = new Date().getTime();

            // Phase Timers
            Object.keys(EXAM_DATA).forEach(key => {
                const target = new Date(EXAM_DATA[key].startDate).getTime();
                const diff = target - now;
                const days = Math.max(0, Math.floor(diff / (1000 * 60 * 60 * 24)));
                const el = document.getElementById('timer-phase-' + key);
                if (el) el.innerText = days;

                // Row Timers
                EXAM_DATA[key].schedule.forEach((exam, i) => {
                    const rowEl = document.getElementById(`timer-row-${key}-${i}`);
                    if (!rowEl) return;

                    const examTarget = new Date(exam.iso).getTime();
                    const examDiff = examTarget - now;

                    if (examDiff <= 0) {
                        rowEl.innerText = "Completed";
                        rowEl.className = "text-slate-400 text-xs font-medium";
                    } else {
                        const d = Math.floor(examDiff / (1000 * 60 * 60 * 24));
                        const h = Math.floor((examDiff / (1000 * 60 * 60)) % 24);
                        const m = Math.floor((examDiff / (1000 * 60)) % 60);
                        rowEl.innerText = `${d}d ${h}h ${m}m`;
                    }
                });
            });
        }
    </script>
</body>
</html>